,count,titlePaper,citationChicago,citations,link,publishedYear,publishedMonth,locationStudy,"gpsLat, gpsLong",gpsLat,gpsLong,monthsLapsed,radius,red,green,blue
103,67,Enhancement of mesenchymal stem cell chondrogenesis with short-term low intensity pulsed electromagnetic fields,"Parate, Dinesh, Alfredo Franco-Obregón, Jürg Fröhlich, Christian Beyer, Azlina A. Abbas, Tunku Kamarul, James HP Hui, and Zheng Yang. ""Enhancement of mesenchymal stem cell chondrogenesis with short-term low intensity pulsed electromagnetic fields."" Scientific reports 7, no. 1 (2017): 1-13.",33.0,https://pubmed.ncbi.nlm.nih.gov/28842627/,2017.0,8.0," University of Malaya, Malaysia","3.121847300495089, 101.65577254513013",3.1218473,101.6557725,49,36.224489795918366,0.8652,0.8652,0.8652
101,67,Enhancement of mesenchymal stem cell chondrogenesis with short-term low intensity pulsed electromagnetic fields,"Parate, Dinesh, Alfredo Franco-Obregón, Jürg Fröhlich, Christian Beyer, Azlina A. Abbas, Tunku Kamarul, James HP Hui, and Zheng Yang. ""Enhancement of mesenchymal stem cell chondrogenesis with short-term low intensity pulsed electromagnetic fields."" Scientific reports 7, no. 1 (2017): 1-13.",33.0,https://pubmed.ncbi.nlm.nih.gov/28842627/,2017.0,8.0,National University of Singapore,"1.2971145327224607, 103.77922626726141",1.297114533,103.7792263,49,36.224489795918366,0.8692,0.8692,0.8692
102,67,Enhancement of mesenchymal stem cell chondrogenesis with short-term low intensity pulsed electromagnetic fields,"Parate, Dinesh, Alfredo Franco-Obregón, Jürg Fröhlich, Christian Beyer, Azlina A. Abbas, Tunku Kamarul, James HP Hui, and Zheng Yang. ""Enhancement of mesenchymal stem cell chondrogenesis with short-term low intensity pulsed electromagnetic fields."" Scientific reports 7, no. 1 (2017): 1-13.",33.0,https://pubmed.ncbi.nlm.nih.gov/28842627/,2017.0,8.0,"Swiss Federal Institute of Technology (ETH),  Zurich, Switzerland","47.37711509622188, 8.549087090845992",47.3771151,8.549087091,49,36.224489795918366,0.9972,0.9972,0.9972
350,174,Cell-type specific expression of oncogenic and tumor suppressive microRNAs in the human prostate and prostate cancer,"Kumar, Binod, Avi Z. Rosenberg, Su Mi Choi, Karen Fox-Talbot, Angelo M. De Marzo, Larisa Nonn, W. Nathaniel Brennen, Luigi Marchionni, Marc K. Halushka, and Shawn E. Lupold. ""Cell-type specific expression of oncogenic and tumor suppressive microRNAs in the human prostate and prostate cancer."" Scientific reports 8, no. 1 (2018): 1-13.",30.0,https://pubmed.ncbi.nlm.nih.gov/29739972/,2018.0,5.0,"Johns Hopkins School of Medicine, Baltimore, MD","39.29978034133384, -76.58801551741551",39.29978034,-76.58801552,40,5.0,0.048,0.048,0.048
351,174,Cell-type specific expression of oncogenic and tumor suppressive microRNAs in the human prostate and prostate cancer,"Kumar, Binod, Avi Z. Rosenberg, Su Mi Choi, Karen Fox-Talbot, Angelo M. De Marzo, Larisa Nonn, W. Nathaniel Brennen, Luigi Marchionni, Marc K. Halushka, and Shawn E. Lupold. ""Cell-type specific expression of oncogenic and tumor suppressive microRNAs in the human prostate and prostate cancer."" Scientific reports 8, no. 1 (2018): 1-13.",30.0,https://pubmed.ncbi.nlm.nih.gov/29739972/,2018.0,5.0,"University of Illinois, Chicago, IL","41.88187326648898, -87.60333436779815",41.88187327,-87.60333437,40,5.0,0.051,0.051,0.051
310,156,IFN-γ and TNF-α Pre-licensing Protects Mesenchymal Stromal Cells from the Pro-inflammatory Effects of Palmitate,"Boland, Lauren, Anthony J. Burand, Alex J. Brown, Devlin Boyt, Vitor A. Lira, and James A. Ankrum. ""IFN-γ and TNF-α pre-licensing protects mesenchymal stromal cells from the pro-inflammatory effects of palmitate."" Molecular Therapy 26, no. 3 (2018): 860-873.",28.0,https://pubmed.ncbi.nlm.nih.gov/29352647/,2017.0,12.0,"University of Iowa, Iowa City, IA","41.66312425862814, -91.5561787634356",41.66312426,-91.55617876,45,21.11111111111111,0.8852,0.8852,0.8852
355,178,Microfluidic label-free selection of mesenchymal stem cell subpopulation during culture expansion extends the chondrogenic potential in vitro,"Yin, Lu, Yingnan Wu, Zheng Yang, Ching Ann Tee, Vinitha Denslin, Zhangxing Lai, Chwee Teck Lim, Eng Hin Lee, and Jongyoon Han. ""Microfluidic label-free selection of mesenchymal stem cell subpopulation during culture expansion extends the chondrogenic potential in vitro."" Lab on a Chip 18, no. 6 (2018): 878-889.",28.0,https://pubmed.ncbi.nlm.nih.gov/29459915/,2018.0,3.0,"Agency for Science, Technology and Research (A*STAR), Singapore","1.2991735192438922, 103.7863205173413",1.299173519,103.7863205,42,11.904761904761905,0.9732,0.9732,0.9732
98,64,3D Printed Vascular Networks Enhance Viability in High-Volume Perfusion Bioreactor,"Ball, Owen, Bao-Ngoc B. Nguyen, Jesse K. Placone, and John P. Fisher. ""3D printed vascular networks enhance viability in high-volume perfusion bioreactor."" Annals of biomedical engineering 44, no. 12 (2016): 3435-3445.",26.0,https://pubmed.ncbi.nlm.nih.gov/27272210/,2016.0,12.0,"University of Maryland, College Park, MD","38.98758512279344, -76.9438847109073",38.98758512,-76.94388471,57,45.26315789473684,0.0,0.0,0.0
128,83,Aggregation of culture expanded human mesenchymal stem cells in microcarrier-based bioreactor,"Yuan, Xuegang, Ang-Chen Tsai, Iain Farrance, Jon A. Rowley, and Teng Ma. ""Aggregation of culture expanded human mesenchymal stem cells in microcarrier-based bioreactor."" Biochemical engineering journal 131 (2018): 39-46.",24.0,https://pubmed.ncbi.nlm.nih.gov/29736144/,2018.0,3.0,Florida State University,"30.44211424930763, -84.29806874332263",30.44211425,-84.29806874,42,10.952380952380953,0.9892,0.9892,0.9892
77,48,"In Vitro Cytokine Licensing Induces Persistent Permissive Chromatin at the Indoleamine 2,3-dioxygenase Promoter","Gonzalez, Yazmin I. Rovira, Patrick J. Lynch, Elaine E. Thompson, Brian G. Stultz, and Deborah A. Hursh. ""In vitro cytokine licensing induces persistent permissive chromatin at the Indoleamine 2, 3-dioxygenase promoter."" Cytotherapy 18, no. 9 (2016): 1114-1128.",23.0,https://pubmed.ncbi.nlm.nih.gov/27421739/,2016.0,7.0," US Food and Drug Administration, Silver Spring, Maryland, USA","39.03616503850735, -76.98049559939903",39.03616504,-76.9804956,62,47.58064516129032,0.8532,0.8532,0.8532
368,186,Three-Dimensional Mechanical Loading Modulates the Osteogenic Response of Mesenchymal Stem Cells to Tumor-Derived Soluble Signals,"Lynch, Maureen E., Aaron E. Chiou, Min Joon Lee, Stephen C. Marcott, Praveen V. Polamraju, Yeonkyung Lee, and Claudia Fischbach. ""Three-dimensional mechanical loading modulates the osteogenic response of mesenchymal stem cells to tumor-derived soluble signals."" Tissue Engineering Part A 22, no. 15-16 (2016): 1006-1015.",22.0,https://pubmed.ncbi.nlm.nih.gov/27401765/,2016.0,8.0,"University of Massachusetts Amherst , Amherst, Massachusetts","42.38736172296981, -72.53159648578766",42.38736172,-72.53159649,61,44.59016393442623,0.9152,0.9152,0.9152
353,176,Deformability of Human Mesenchymal Stem Cells Is Dependent on Vimentin Intermediate Filaments,"Sharma, Poonam, Zachary T. Bolten, Diane R. Wagner, and Adam H. Hsieh. ""Deformability of human mesenchymal stem cells is dependent on vimentin intermediate filaments."" Annals of biomedical engineering 45, no. 5 (2017): 1365-1374.",22.0,https://pubmed.ncbi.nlm.nih.gov/28091965/,2017.0,5.0,"University of Maryland, College Park, Maryland","38.98755176704997, -76.94379888012814",38.98755177,-76.94379888,52,31.538461538461537,1.0,1.0,1.0
367,186,Three-Dimensional Mechanical Loading Modulates the Osteogenic Response of Mesenchymal Stem Cells to Tumor-Derived Soluble Signals,"Lynch, Maureen E., Aaron E. Chiou, Min Joon Lee, Stephen C. Marcott, Praveen V. Polamraju, Yeonkyung Lee, and Claudia Fischbach. ""Three-dimensional mechanical loading modulates the osteogenic response of mesenchymal stem cells to tumor-derived soluble signals."" Tissue Engineering Part A 22, no. 15-16 (2016): 1006-1015.",22.0,https://pubmed.ncbi.nlm.nih.gov/27401765/,2016.0,8.0,"Cornell University , Ithaca","42.45398715515518, -76.47260151129899",42.45398716,-76.47260151,61,44.59016393442623,1.0,1.0,1.0
357,180,Enhanced Non-viral Gene Delivery by Coordinated Endosomal Release and Inhibition of β-tubulin Deactylase,"Ho, Yoon Khei, Li Han Zhou, Kam C. Tam, and Heng Phon Too. ""Enhanced non-viral gene delivery by coordinated endosomal release and inhibition of β-tubulin deactylase."" Nucleic acids research 45, no. 6 (2017): e38-e38.",22.0,https://pubmed.ncbi.nlm.nih.gov/27899629/,2017.0,4.0,"Agency for Science, Technology and Research (A*STAR), Singapore","1.2991735192438922, 103.7863205173413",1.299173519,103.7863205,53,33.20754716981132,0.0,0.0,0.0
146,93,Tubulogenesis of Co-cultured Human iPS-derived Endothelial Cells and Human Mesenchymal Stem Cells in Fibrin and Gelatin Methacrylate Gels,"Calderon, G. A., P. Thai, C. W. Hsu, B. Grigoryan, S. M. Gibson, M. E. Dickinson, and J. S. Miller. ""Tubulogenesis of co-cultured human iPS-derived endothelial cells and human mesenchymal stem cells in fibrin and gelatin methacrylate gels."" Biomaterials science 5, no. 8 (2017): 1652-1660.",21.0,https://pubmed.ncbi.nlm.nih.gov/28661522/,2017.0,7.0,Rice University,"29.71828831596593, -95.4014450013275",29.71828832,-95.401445,50,27.0,0.141,0.141,0.141
88,57,Hypoxic Expansion of Human Mesenchymal Stem Cells Enhances Three-Dimensional Maturation of Tissue-Engineered Intervertebral Discs,"Hudson, Katherine D., and Lawrence J. Bonassar. ""Hypoxic expansion of human mesenchymal stem cells enhances three-dimensional maturation of tissue-engineered intervertebral discs."" Tissue Engineering Part A 23, no. 7-8 (2017): 293-300.",21.0,https://pubmed.ncbi.nlm.nih.gov/27903131/,2017.0,4.0,"Cornell University , Ithaca, New York","42.45373384274314, -76.47170028914752",42.45373384,-76.47170029,53,31.9811320754717,0.8872,0.8872,0.8872
74,46,Rapid Selection of Mesenchymal Stem and Progenitor Cells in Primary Prostate Stromal Cultures,"Brennen, W. Nathaniel, L. Nelleke Kisteman, and John T. Isaacs. ""Rapid selection of mesenchymal stem and progenitor cells in primary prostate stromal cultures."" The Prostate 76, no. 6 (2016): 552-564.",17.0,https://pubmed.ncbi.nlm.nih.gov/26732992/,2016.0,1.0,"Johns Hopkins University School of Medicine, Baltimore, Maryland","39.29991317849294, -76.59166332145463",39.29991318,-76.59166332,68,42.05882352941177,1.0,1.0,1.0
126,82,Mesenchymal stem cell infiltration during neoplastic transformation of the human prostate,"Brennen, W. Nathaniel, Baohui Zhang, Ibrahim Kulac, L. Nelleke Kisteman, Lizamma Antony, Hao Wang, Alan K. Meeker et al. ""Mesenchymal stem cell infiltration during neoplastic transformation of the human prostate."" Oncotarget 8, no. 29 (2017): 46710.",16.0,https://pubmed.ncbi.nlm.nih.gov/28493842/,2017.0,7.0,"Sidney Kimmel Comprehensive Cancer Center at Johns Hopkins, Baltimore, MD","39.30330140191949, -76.5797892872777",39.3033014,-76.57978929,50,22.0,0.0,0.0,0.0
127,82,Mesenchymal stem cell infiltration during neoplastic transformation of the human prostate,"Brennen, W. Nathaniel, Baohui Zhang, Ibrahim Kulac, L. Nelleke Kisteman, Lizamma Antony, Hao Wang, Alan K. Meeker et al. ""Mesenchymal stem cell infiltration during neoplastic transformation of the human prostate."" Oncotarget 8, no. 29 (2017): 46710.",16.0,https://pubmed.ncbi.nlm.nih.gov/28493842/,2017.0,7.0,"David Geffen School of Medicine at UCLA, Los Angeles, CA","34.064886962737134, -118.43991006309508",34.06488696,-118.4399101,50,22.0,0.0,0.0,0.0
365,185,Growth Factor Dose Tuning for Bone Progenitor Cell Proliferation and Differentiation on Resorbable Poly(propylene fumarate) Scaffolds,"Mishra, Ruchi, Ryan S. Sefcik, Tyler J. Bishop, Stefani M. Montelone, Nisha Crouser, Jean F. Welter, Arnold I. Caplan, and David Dean. ""Growth factor dose tuning for bone progenitor cell proliferation and differentiation on resorbable poly (propylene fumarate) scaffolds."" Tissue Engineering Part C: Methods 22, no. 9 (2016): 904-913.",16.0,https://pubmed.ncbi.nlm.nih.gov/27558310/,2016.0,9.0,"The Ohio State University , Columbus, Ohio","40.007132176567666, -83.02835178300128",40.00713218,-83.02835178,60,33.33333333333333,0.0,0.0,0.0
366,185,Growth Factor Dose Tuning for Bone Progenitor Cell Proliferation and Differentiation on Resorbable Poly(propylene fumarate) Scaffolds,"Mishra, Ruchi, Ryan S. Sefcik, Tyler J. Bishop, Stefani M. Montelone, Nisha Crouser, Jean F. Welter, Arnold I. Caplan, and David Dean. ""Growth factor dose tuning for bone progenitor cell proliferation and differentiation on resorbable poly (propylene fumarate) scaffolds."" Tissue Engineering Part C: Methods 22, no. 9 (2016): 904-913.",16.0,https://pubmed.ncbi.nlm.nih.gov/27558310/,2016.0,9.0,"Case Western Reserve University , Cleveland","41.504598085469645, -81.60563725211887",41.50459809,-81.60563725,60,33.33333333333333,0.0,0.0,0.0
154,100,Physical confinement alters cytoskeletal contributions towards human mesenchymal stem cell migration,"Doolin, Mary T., and Kimberly M. Stroka. ""P hysical confinement alters cytoskeletal contributions towards human mesenchymal stem cell migration."" Cytoskeleton 75, no. 3 (2018): 103-117.",15.0,https://pubmed.ncbi.nlm.nih.gov/29316327/,2018.0,3.0,"University of Maryland, College Park, Maryland","38.98735162104913, -76.94397054159174",38.98735162,-76.94397054,42,8.80952380952381,0.0,0.0,0.0
73,45, Identification of Predictive Gene Markers for Multipotent Stromal Cell Proliferation,"Bellayr, Ian H., Ross A. Marklein, Jessica L. Lo Surdo, Steven R. Bauer, and Raj K. Puri. ""Identification of predictive gene markers for multipotent stromal cell proliferation."" Stem cells and development 25, no. 11 (2016): 861-873.",15.0,https://pubmed.ncbi.nlm.nih.gov/27036644/,2016.0,6.0,"US Food and Drug Administration, Silver Spring, Maryland","39.03616503850735, -76.98049559939903",39.03616504,-76.9804956,63,34.2063492063492,0.0,0.0,0.0
334,166,Deciphering the Role of Substrate Stiffness in Enhancing the Internalization Efficiency of Plasmid DNA in Stem Cells Using Lipid-based Nanocarriers,"Modaresi, Saman, Settimio Pacelli, Jonathan Whitlow, and Arghya Paul. ""Deciphering the role of substrate stiffness in enhancing the internalization efficiency of plasmid DNA in stem cells using lipid-based nanocarriers."" Nanoscale 10, no. 19 (2018): 8947-8952.",14.0,https://pubmed.ncbi.nlm.nih.gov/29693099/,2018.0,5.0,"University of Kansas, Lawrence, KS","38.95464393091953, -95.257169426168",38.95464393,-95.25716943,40,5.0,0.9052,0.9052,0.9052
78,49,Further Observations on the Behavioral and Neural Effects of Bone Marrow Stromal Cells in Rodent Pain Models,"Guo, Wei, Yu-Xia Chu, Satoshi Imai, Jia-Le Yang, Shiping Zou, Zaid Mohammad, Feng Wei, Ronald Dubner, and Ke Ren. ""Further observations on the behavioral and neural effects of bone marrow stromal cells in rodent pain models."" Molecular pain 12 (2016): 1744806916658043.",14.0,https://pubmed.ncbi.nlm.nih.gov/27329776/,2016.0,6.0,University of Maryland School of Denstistry,"39.289935519141046, -76.6222742691396",39.28993552,-76.62227427,63,32.38095238095238,1.0,1.0,1.0
145,92,Material Viscoelastic Properties Modulate the Mesenchymal Stem Cell Secretome for Applications in Hematopoietic Recovery,"Liu, Frances D., Novalia Pishesha, Zhiyong Poon, Tanwi Kaushik, and Krystyn J. Van Vliet. ""Material viscoelastic properties modulate the mesenchymal stem cell secretome for applications in hematopoietic recovery."" ACS Biomaterials Science & Engineering 3, no. 12 (2017): 3292-3306.",14.0,https://pubs.acs.org/doi/abs/10.1021/acsbiomaterials.7b00644,2017.0,10.0,"Singapore−MIT Alliance for Research and Technology, CREATE, Singapore","1.2992185495878086, 103.77421997575927",1.29921855,103.77422,47,16.170212765957448,0.9332,0.9332,0.9332
144,92,Material Viscoelastic Properties Modulate the Mesenchymal Stem Cell Secretome for Applications in Hematopoietic Recovery,"Liu, Frances D., Novalia Pishesha, Zhiyong Poon, Tanwi Kaushik, and Krystyn J. Van Vliet. ""Material viscoelastic properties modulate the mesenchymal stem cell secretome for applications in hematopoietic recovery."" ACS Biomaterials Science & Engineering 3, no. 12 (2017): 3292-3306.",14.0,https://pubs.acs.org/doi/abs/10.1021/acsbiomaterials.7b00644,2017.0,10.0,"Massachusetts Institute of Technology, Cambridge, Massachusetts","42.360344356184285, -71.0914563670104",42.36034436,-71.09145637,47,16.170212765957448,0.9692,0.9692,0.9692
152,98,Guanylate Binding Protein 1 Inhibits Osteogenic Differentiation of Human Mesenchymal Stromal Cells Derived from Bone Marrow,"Bai, Shi, Zhixiang Mu, Yuanding Huang, and Ping Ji. ""Guanylate binding protein 1 inhibits osteogenic differentiation of human mesenchymal stromal cells derived from bone marrow."" Scientific reports 8, no. 1 (2018): 1-8.",12.0,https://pubmed.ncbi.nlm.nih.gov/29348519/,2018.0,1.0,"Stomatological hospital of Chongqing Medical University, Chongqing, China","29.560578289364614, 106.54845632024663",29.56057829,106.5484563,44,10.909090909090908,0.9772,0.9772,0.9772
94,61,Ultrahigh-throughput Generation and Characterization of Cellular Aggregates in Laser-ablated Microwells of Poly(dimethylsiloxane),"Albritton, Jacob L., Jonathon D. Roybal, Samantha J. Paulsen, Nicholas J. Calafat, Jose A. Flores-Zaher, Mary C. Farach-Carson, Don L. Gibbons, and Jordan S. Miller. ""Ultrahigh-throughput generation and characterization of cellular aggregates in laser-ablated microwells of poly (dimethylsiloxane)."" RSC advances 6, no. 11 (2016): 8980-8991.",12.0,https://pubmed.ncbi.nlm.nih.gov/26998251/,2016.0,1.0,"Rice University, Houston, Texas, USA","29.718027419810287, -95.40178832406527",29.71802742,-95.40178832,68,31.76470588235294,0.8592,0.8592,0.8592
95,61,Ultrahigh-throughput Generation and Characterization of Cellular Aggregates in Laser-ablated Microwells of Poly(dimethylsiloxane),"Albritton, Jacob L., Jonathon D. Roybal, Samantha J. Paulsen, Nicholas J. Calafat, Jose A. Flores-Zaher, Mary C. Farach-Carson, Don L. Gibbons, and Jordan S. Miller. ""Ultrahigh-throughput generation and characterization of cellular aggregates in laser-ablated microwells of poly (dimethylsiloxane)."" RSC advances 6, no. 11 (2016): 8980-8991.",12.0,https://pubmed.ncbi.nlm.nih.gov/26998251/,2016.0,1.0,"The University of Texas M.D. Anderson Cancer Center, Houston, Texas","29.70763436074634, -95.39445107285172",29.70763436,-95.39445107,68,31.76470588235294,1.0,1.0,1.0
147,94,Tissue Source and Cell Expansion Condition Influence Phenotypic Changes of Adipose-Derived Stem Cells,"Mangum, Lauren H., Shanmugasundaram Natesan, Randolph Stone, Nicole L. Wrice, David A. Larson, Kyle F. Florell, Barbara A. Christy, Maryanne C. Herzig, Andrew P. Cap, and Robert J. Christy. ""Tissue source and cell expansion condition influence phenotypic changes of adipose-derived stem cells."" Stem cells international 2017 (2017).",9.0,https://pubmed.ncbi.nlm.nih.gov/29138638/,2017.0,8.0,"San Antonio Military Medical Center, JBSA Ft Sam Houston, San Antonio, TX","29.460236709816368, -98.41527511787203",29.46023671,-98.41527512,49,14.183673469387754,0.03,0.03,0.03
139,89,Sustained Releasing Sponge-like 3d Scaffolds for Bone Tissue Engineering Applications,"Chamundeswari, Vidya N., Lui Yuan Siang, Yon Jin Chuah, Jing Shi Tan, Dong-An Wang, and Say Chye Joachim Loo. ""Sustained releasing sponge-like 3D scaffolds for bone tissue engineering applications."" Biomedical Materials 13, no. 1 (2017): 015019.",9.0,https://pubmed.ncbi.nlm.nih.gov/28895559/,2017.0,12.0,"Nanyang Technological University, Singapore","1.349082146445041, 103.68287716262252",1.349082146,103.6828772,45,10.555555555555555,0.15,0.15,0.15
130,84,Adaptation of a Simple Microfluidic Platform for High-Dimensional Quantitative Morphological Analysis of Human Mesenchymal Stromal Cells on Polystyrene-Based Substrates,"Lam, Johnny, Ross A. Marklein, Jose A. Jimenez-Torres, David J. Beebe, Steven R. Bauer, and Kyung E. Sung. ""Adaptation of a simple microfluidic platform for high-dimensional quantitative morphological analysis of human mesenchymal stromal cells on polystyrene-based substrates."" SLAS TECHNOLOGY: Translating Life Sciences Innovation 22, no. 6 (2017): 646-661.",8.0,https://pubmed.ncbi.nlm.nih.gov/28825968/,2017.0,12.0,"University of Wisconsin-Madison, Madison, WI","43.07724995277269, -89.4102130200505",43.07724995,-89.41021302,45,10.0,0.9772,0.9772,0.9772
129,84,Adaptation of a Simple Microfluidic Platform for High-Dimensional Quantitative Morphological Analysis of Human Mesenchymal Stromal Cells on Polystyrene-Based Substrates,"Lam, Johnny, Ross A. Marklein, Jose A. Jimenez-Torres, David J. Beebe, Steven R. Bauer, and Kyung E. Sung. ""Adaptation of a simple microfluidic platform for high-dimensional quantitative morphological analysis of human mesenchymal stromal cells on polystyrene-based substrates."" SLAS TECHNOLOGY: Translating Life Sciences Innovation 22, no. 6 (2017): 646-661.",8.0,https://pubmed.ncbi.nlm.nih.gov/28825968/,2017.0,12.0,"Food and Drug Administration, Silver Spring, MD","39.035798358803326, -76.98023810734571",39.03579836,-76.98023811,45,10.0,0.9912,0.9912,0.9912
153,99,Effect of Hydrogel Material Composition on Hbmsc Differentiation Into Zone-specific Neo-cartilage: Engineering Human Articular Cartilage-like Tissue With Spatially Varying Properties,"Parratt, Kirsten, Madeline Smerchansky, Qwantayvious Stiggers, and Krishnendu Roy. ""Effect of hydrogel material composition on hBMSC differentiation into zone-specific neo-cartilage: engineering human articular cartilage-like tissue with spatially varying properties."" Journal of Materials Chemistry B 5, no. 31 (2017): 6237-6248.",8.0,https://pubs.rsc.org/en/content/articlelanding/2017/tb/c7tb00896a,2017.0,7.0,"Georgia Institute of Technology, Atlanta, GA","33.77622391514814, -84.39761541333719",33.77622392,-84.39761541,50,14.0,0.075,0.075,0.075
328,162,Multidrug-eluting Bi-layered Microparticle-mesh Scaffolds for Musculoskeletal Tissue Regeneration,"Chamundeswari, Vidya N., Yon Jin Chuah, and Say Chye Joachim Loo. ""Multidrug-eluting bi-layered microparticle-mesh scaffolds for musculoskeletal tissue regeneration."" Journal of Materials Chemistry B 6, no. 20 (2018): 3340-3347.",5.0,https://pubs.rsc.org/en/content/articlelanding/2018/tb/c8tb00397a,2018.0,5.0,Nanyang Technological University,"1.3483527878036905, 103.68154678718932",1.348352788,103.6815468,40,5.0,0.03,0.03,0.03
151,97,"3D Material Cytometry (3DMaC): a Very High-replicate, High-throughput Analytical Method Using Microfabricated, Shape-specific, Cell-material Niches","Parratt, Kirsten, Jenny Jeong, Peng Qiu, and Krishnendu Roy. ""3D material cytometry (3DMaC): a very high-replicate, high-throughput analytical method using microfabricated, shape-specific, cell-material niches."" Lab on a Chip 17, no. 16 (2017): 2861-2872.",4.0,https://pubmed.ncbi.nlm.nih.gov/28726912/,2017.0,8.0,"Georgia Institute of Technology, Atlanta, GA","33.77622391514814, -84.39761541333719",33.77622392,-84.39761541,49,9.591836734693878,0.8772,0.8772,0.8772
117,78,Influence of Fibrinogen Concentration on Mesenchymal Stem Cells and Chondrocytes Chondrogenesis in Fibrin Hydrogels,"Yang, Zheng, Vinitha Denslin, Yingnan Wu, Eng Hin Lee, Azlina A. Abbas, Tunku Kamarul, and James HP Hui. ""Influence of fibrinogen concentration on mesenchymal stem cells and chondrocytes chondrogenesis in fibrin hydrogels."" Journal of Biomaterials and Tissue Engineering 7, no. 11 (2017): 1136-1145.",4.0,https://www.ingentaconnect.com/content/asp/jbte/2017/00000007/00000011/art00010;jsessionid=t2p1nwooec8r.x-ic-live-03,2017.0,11.0,National University of Singapore,"1.297457767470151, 103.77879711383922",1.297457767,103.7787971,46,8.26086956521739,0.0,0.0,0.0
156,101,Emerging Business Models Toward Commercialization of Bioprinting Technology,"Balakhovsky, Yakov M., Alexander Yu Ostrovskiy, and Yusef D. Khesuani. ""Emerging business models toward commercialization of bioprinting technology."" 3D Printing and Biofabrication. Springer, Berlin (2017): 1-22.",3.0,https://link.springer.com/referenceworkentry/10.1007%2F978-3-319-40498-1_25-1,2017.0,7.0,Independent Laboratory INVITRO Moscow Russian Federation,"55.77447099420904, 37.6044407756212",55.77447099,37.60444078,50,9.0,0.9092,0.9092,0.9092
155,101,Emerging Business Models Toward Commercialization of Bioprinting Technology,"Balakhovsky, Yakov M., Alexander Yu Ostrovskiy, and Yusef D. Khesuani. ""Emerging business models toward commercialization of bioprinting technology."" 3D Printing and Biofabrication. Springer, Berlin (2017): 1-22.",3.0,https://link.springer.com/referenceworkentry/10.1007%2F978-3-319-40498-1_25-1,2017.0,7.0,"Vivax Bio, LLC New York USA","40.727950944548304, -74.0020449144394",40.72795094,-74.00204491,50,9.0,0.9192,0.9192,0.9192
354,177,Particle aggregates formed during furfuryl methacrylate plasma polymerization affect human mesenchymal stem cell behaviour,"Shirazi, Hanieh Safizadeh, Nicholas Rogers, Andrew Michelmore, and Jason D. Whittle. ""Particle aggregates formed during furfuryl methacrylate plasma polymerization affect human mesenchymal stem cell behaviour."" Colloids and Surfaces B: Biointerfaces 161 (2018): 261-268.",1.0,https://pubmed.ncbi.nlm.nih.gov/29096370/,2018.0,1.0,"University of South Australia, Mawson Lakes, Adelaide","-34.91546965657456, 138.62230625033314",-34.91546966,138.6223063,44,5.909090909090909,0.129,0.129,0.129
